{
  "$schema": "https://crossforge.dev/schemas/rpm-source-lock.schema.json",
  "input_sha256": "3812ff7de1f57952390402da0bf699dd26d441375188f605204ee7b8a883429a",
  "kind": "crossforge-rpm-source-lock",
  "repositories": [
    {
      "baseurl": "https://download.rockylinux.org/pub/rocky/8.10/BaseOS/source/tree/",
      "id": "baseos"
    },
    {
      "baseurl": "https://download.rockylinux.org/pub/rocky/8.10/AppStream/source/tree/",
      "id": "appstream"
    },
    {
      "baseurl": "https://download.rockylinux.org/pub/rocky/8.10/PowerTools/source/tree/",
      "id": "powertools"
    }
  ],
  "requirements": {
    "canonical_sha256": "cfd286fbbc4da50d8f2126d6cc8bfecba64c0031a7a74083489b77157862a4eb",
    "file": "evidence/sources/rpm-source-requirements.json"
  },
  "schema_version": 1,
  "sources": [
    {
      "aliases": [],
      "header_verified": true,
      "repository": "baseos",
      "sha256": "a3f8e2d81a0ccee398536b6121af4e0ae08cb0707f3b33838d8b36e18f6658a1",
      "signature_verified": true,
      "size": 548730,
      "source_rpm": "acl-2.2.53-3.el8.src.rpm",
      "url": "https://download.rockylinux.org/pub/rocky/8.10/BaseOS/source/tree/Packages/a/acl-2.2.53-3.el8.src.rpm"
    },
    {
      "aliases": [],
      "header_verified": true,
      "repository": "baseos",
      "sha256": "cf1be9e3b658e9d1b38f7a84d3d03932f1616e114d9b5b07b85a6c758763f9a9",
      "signature_verified": true,
      "size": 614088,
      "source_rpm": "acl-2.4.0-1.el8_10.src.rpm",
      "url": "https://download.rockylinux.org/pub/rocky/8.10/BaseOS/source/tree/Packages/a/acl-2.4.0-1.el8_10.src.rpm"
    },
    {
      "aliases": [],
      "header_verified": true,
      "repository": "appstream",
      "sha256": "e0054b75f1d47dafd2961ed58acbda19d0089eaefe18ce1e3be91a302c514acf",
      "signature_verified": true,
      "size": 1189711,
      "source_rpm": "alsa-lib-1.2.10-2.el8.src.rpm",
      "url": "https://download.rockylinux.org/pub/rocky/8.10/AppStream/source/tree/Packages/a/alsa-lib-1.2.10-2.el8.src.rpm"
    },
    {
      "aliases": [],
      "header_verified": true,
      "repository": "appstream",
      "sha256": "a471c85bb47181aa6b7c6371df167730f6ff4a11a794d6cd4c5f1c07d4da738b",
      "signature_verified": true,
      "size": 921604,
      "source_rpm": "annobin-11.13-2.el8.src.rpm",
      "url": "https://download.rockylinux.org/pub/rocky/8.10/AppStream/source/tree/Packages/a/annobin-11.13-2.el8.src.rpm"
    },
    {
      "aliases": [],
      "header_verified": true,
      "repository": "appstream",
      "sha256": "c867fb7f040e42861e964b1c5ad200f45a074a6ff2ed7c258c0dfbe003637dc3",
      "signature_verified": true,
      "size": 208732,
      "source_rpm": "at-spi2-core-2.28.0-1.el8.src.rpm",
      "url": "https://download.rockylinux.org/pub/rocky/8.10/AppStream/source/tree/Packages/a/at-spi2-core-2.28.0-1.el8.src.rpm"
    },
    {
      "aliases": [],
      "header_verified": true,
      "repository": "baseos",
      "sha256": "d89e1ed014eac96623391475d614875ff3ba4ca35b2786e514368cbaf5526e17",
      "signature_verified": true,
      "size": 490079,
      "source_rpm": "attr-2.4.48-3.el8.src.rpm",
      "url": "https://download.rockylinux.org/pub/rocky/8.10/BaseOS/source/tree/Packages/a/attr-2.4.48-3.el8.src.rpm"
    },
    {
      "aliases": [],
      "header_verified": true,
      "repository": "baseos",
      "sha256": "6e0ce9b068723a190688ac8947933f3e7f2a94abdadbd906e37bec20c5c8b623",
      "signature_verified": true,
      "size": 391092,
      "source_rpm": "attr-2.6.0-1.el8_10.src.rpm",
      "url": "https://download.rockylinux.org/pub/rocky/8.10/BaseOS/source/tree/Packages/a/attr-2.6.0-1.el8_10.src.rpm"
    },
    {
      "aliases": [],
      "header_verified": true,
      "repository": "baseos",
      "sha256": "e93fe0aa24886da352b996ed05871ed169a6375696912bc585c5277b61f264db",
      "signature_verified": true,
      "size": 1247531,
      "source_rpm": "audit-3.1.2-1.el8.src.rpm",
      "url": "https://download.rockylinux.org/pub/rocky/8.10/BaseOS/source/tree/Packages/a/audit-3.1.2-1.el8.src.rpm"
    },
    {
      "aliases": [],
      "header_verified": true,
      "repository": "baseos",
      "sha256": "bb026c79c6e580f67256553f95712d30e308a15fdaf22cdcf2700908e530a47e",
      "signature_verified": true,
      "size": 1249311,
      "source_rpm": "audit-3.1.2-1.el8_10.1.src.rpm",
      "url": "https://download.rockylinux.org/pub/rocky/8.10/BaseOS/source/tree/Packages/a/audit-3.1.2-1.el8_10.1.src.rpm"
    },
    {
      "aliases": [],
      "header_verified": true,
      "repository": "appstream",
      "sha256": "00ba38d9c238aca34581548d3a151c1ef419a360236faab04078a27d8766cb90",
      "signature_verified": true,
      "size": 1244853,
      "source_rpm": "autoconf-2.69-29.el8_10.1.src.rpm",
      "url": "https://download.rockylinux.org/pub/rocky/8.10/AppStream/source/tree/Packages/a/autoconf-2.69-29.el8_10.1.src.rpm"
    },
    {
      "aliases": [],
      "header_verified": true,
      "repository": "appstream",
      "sha256": "d46fa695bcf735dfa988881cec41a02b7af8bf86b6812c36c09fa99a28a96f3a",
      "signature_verified": true,
      "size": 1599558,
      "source_rpm": "automake-1.16.1-8.el8.src.rpm",
      "url": "https://download.rockylinux.org/pub/rocky/8.10/AppStream/source/tree/Packages/a/automake-1.16.1-8.el8.src.rpm"
    },
    {
      "aliases": [],
      "header_verified": true,
      "repository": "baseos",
      "sha256": "296fd566424e48d0ef4b1d404f761914bef0946030bc50c2612e1138c9f23b30",
      "signature_verified": true,
      "size": 1364727,
      "source_rpm": "avahi-0.7-27.el8_10.1.src.rpm",
      "url": "https://download.rockylinux.org/pub/rocky/8.10/BaseOS/source/tree/Packages/a/avahi-0.7-27.el8_10.1.src.rpm"
    },
    {
      "aliases": [],
      "header_verified": true,
      "repository": "baseos",
      "sha256": "ca225eaa6e5b3bca95cacc06a7b28dba0ae5bd87b91ed66001511d1d65dd1efb",
      "signature_verified": true,
      "size": 1018758,
      "source_rpm": "babeltrace-1.5.4-4.el8.src.rpm",
      "url": "https://download.rockylinux.org/pub/rocky/8.10/BaseOS/source/tree/Packages/b/babeltrace-1.5.4-4.el8.src.rpm"
    },
    {
      "aliases": [],
      "header_verified": true,
      "repository": "baseos",
      "sha256": "6beff4cbfd5425e2c193312a9a184969a27d6bbd2d4cc29d7ce72dbe3d9f6416",
      "signature_verified": true,
      "size": 10758,
      "source_rpm": "basesystem-11-5.el8.src.rpm",
      "url": "https://download.rockylinux.org/pub/rocky/8.10/BaseOS/source/tree/Packages/b/basesystem-11-5.el8.src.rpm"
    },
    {
      "aliases": [],
      "header_verified": true,
      "repository": "baseos",
      "sha256": "2bb3172df895905638992921213c16aee310c90efcc6e819a99fda3eb52953e9",
      "signature_verified": true,
      "size": 9477199,
      "source_rpm": "bash-4.4.20-5.el8.src.rpm",
      "url": "https://download.rockylinux.org/pub/rocky/8.10/BaseOS/source/tree/Packages/b/bash-4.4.20-5.el8.src.rpm"
    },
    {
      "aliases": [],
      "header_verified": true,
      "repository": "baseos",
      "sha256": "e6c85abffb1808308a1ebccbc4a4867e58f38e2e3fd99ff93c00dee924e94be2",
      "signature_verified": true,
      "size": 9478043,
      "source_rpm": "bash-4.4.20-6.el8_10.src.rpm",
      "url": "https://download.rockylinux.org/pub/rocky/8.10/BaseOS/source/tree/Packages/b/bash-4.4.20-6.el8_10.src.rpm"
    },
    {
      "aliases": [],
      "header_verified": true,
      "repository": "baseos",
      "sha256": "18be551663d8f2e4a86c0999d5cb6d734073f991f5a9036da253d8efcee3a33e",
      "signature_verified": true,
      "size": 21025079,
      "source_rpm": "binutils-2.30-123.el8.src.rpm",
      "url": "https://download.rockylinux.org/pub/rocky/8.10/BaseOS/source/tree/Packages/b/binutils-2.30-123.el8.src.rpm"
    },
    {
      "aliases": [],
      "header_verified": true,
      "repository": "appstream",
      "sha256": "1996ed9b3354afa9d993de75a5308d46649c6afdcd3e93aaa79bc3fbe79ffa3c",
      "signature_verified": true,
      "size": 1998895,
      "source_rpm": "bison-3.0.4-10.el8.src.rpm",
      "url": "https://download.rockylinux.org/pub/rocky/8.10/AppStream/source/tree/Packages/b/bison-3.0.4-10.el8.src.rpm"
    },
    {
      "aliases": [],
      "header_verified": true,
      "repository": "baseos",
      "sha256": "b0348ebfddd7f207f2bcbdf3eee6392e4482fac6b271f3a5148decca61ebb6dd",
      "signature_verified": true,
      "size": 23845976,
      "source_rpm": "brotli-1.0.6-4.el8_10.src.rpm",
      "url": "https://download.rockylinux.org/pub/rocky/8.10/BaseOS/source/tree/Packages/b/brotli-1.0.6-4.el8_10.src.rpm"
    },
    {
      "aliases": [],
      "header_verified": true,
      "repository": "baseos",
      "sha256": "e0b55db7064c21507ba4f2c440a5ae4e6019a79bbc89045f28edc204af0d74f3",
      "signature_verified": true,
      "size": 804194,
      "source_rpm": "bzip2-1.0.6-26.el8.src.rpm",
      "url": "https://download.rockylinux.org/pub/rocky/8.10/BaseOS/source/tree/Packages/b/bzip2-1.0.6-26.el8.src.rpm"
    },
    {
      "aliases": [],
      "header_verified": true,
      "repository": "baseos",
      "sha256": "08a13db5dfd0ef88e2169bde7426a59d290cc690ed4256dfda640a680fe71f7c",
      "signature_verified": true,
      "size": 806082,
      "source_rpm": "bzip2-1.0.6-28.el8_10.src.rpm",
      "url": "https://download.rockylinux.org/pub/rocky/8.10/BaseOS/source/tree/Packages/b/bzip2-1.0.6-28.el8_10.src.rpm"
    },
    {
      "aliases": [],
      "header_verified": true,
      "repository": "baseos",
      "sha256": "0ee040613dcd861cbf927602b43f30e4663139f7c7a8eb234fd514a657bf0dc3",
      "signature_verified": true,
      "size": 684745,
      "source_rpm": "ca-certificates-2023.2.60_v7.0.306-80.0.el8_8.src.rpm",
      "url": "https://download.rockylinux.org/pub/rocky/8.10/BaseOS/source/tree/Packages/c/ca-certificates-2023.2.60_v7.0.306-80.0.el8_8.src.rpm"
    },
    {
      "aliases": [],
      "header_verified": true,
      "repository": "baseos",